{
  "milestone_id": "CAREER_OS_PHASE_F_AUTHORIZATION_V1",
  "kind": "GOVERNANCE_SYNC",
  "goal": "Record Bora's explicit 2026-09-13 authorization of CAREER_OS_TRACE_AND_CONTRACT_ARCHITECTURE_V1 (Phase F - Trace/Contract Architecture) as the next bounded phase in READ_ONLY / DESIGN_ONLY mode, with implementation_authorized remaining false and Phase G and every later roadmap phase remaining PROPOSED_NOT_AUTHORIZED. This authorization-transition sync does not perform, design, or begin substantive Phase F trace/contract architecture work and does not re-adjudicate the accepted Phase E system eval-set architecture.",
  "baseline_sha": "767aff19a13dbcb33af1d5cd81e5c3edfe6d3bbd",
  "allowed_paths": [
    "project_state.json",
    "CURRENT_EXECUTION_CHECKPOINT.json",
    "CURRENT_MILESTONE.md",
    "CURRENT_STATE.md",
    "AGENTS.md",
    "CHANGELOG.md",
    "docs/decisions/ADR-CAREER-OS-EVAL-HARNESS-SEQUENCE-V1.md",
    "tests/career_os_agent_context_usage_efficiency_v1_test.py",
    "tests/career_os_eval_harness_sequence_v1_test.py",
    "tests/career_os_execution_checkpoint_v1_test.py",
    "tests/career_os_failure_taxonomy_and_evaluator_coverage_map_v1_test.py",
    "tests/career_os_phase_d_authorization_v1_test.py",
    "tests/career_os_phase_e_authorization_v1_test.py",
    "tests/career_os_system_eval_set_architecture_v1_test.py",
    "tests/career_os_phase_f_authorization_v1_test.py",
    "milestone_contracts/governance/career-os-phase-f-authorization-v1.json"
  ],
  "forbidden_paths": [
    "BLUEPRINT.md",
    "CLAUDE.md",
    "GEMINI.md",
    ".cursor/**",
    ".cursorignore",
    ".claude/**",
    "src/**",
    "schemas/**",
    "claims/**",
    "evidence/**",
    "experiences/**",
    "resume/**",
    "golden-tests/**",
    "fixtures/**",
    "config/**",
    "prompts/**",
    "docs/audits/**"
  ],
  "required_tests": [
    "tests/career_os_failure_taxonomy_and_evaluator_coverage_map_v1_test.py",
    "tests/career_os_agent_context_usage_efficiency_v1_test.py",
    "tests/career_os_eval_harness_sequence_v1_test.py",
    "tests/career_os_execution_checkpoint_v1_test.py",
    "tests/career_os_phase_d_authorization_v1_test.py",
    "tests/career_os_phase_e_authorization_v1_test.py",
    "tests/career_os_system_eval_set_architecture_v1_test.py",
    "tests/career_os_phase_f_authorization_v1_test.py"
  ],
  "acceptance_conditions": [
    "CURRENT_EXECUTION_CHECKPOINT.json records phase_id=CAREER_OS_TRACE_AND_CONTRACT_ARCHITECTURE_V1, phase_mode=READ_ONLY_DESIGN_ONLY, authorization_status=BORA_AUTHORIZED, selection_status=SELECTED, operator_status=NOT_YET_COMPLETED, implementation_authorized=false, and preserves CAREER_OS_SYSTEM_EVAL_SET_ARCHITECTURE_V1 (Phase E) as prior_phase in its own distinct COMPLETED_BY_OPERATOR / BORA_ACCEPTED (2026-09-12) / READ_ONLY_DESIGN_ONLY record",
    "project_state.json, CURRENT_MILESTONE.md, CURRENT_STATE.md, AGENTS.md, and docs/decisions/ADR-CAREER-OS-EVAL-HARNESS-SEQUENCE-V1.md are mutually consistent with the checkpoint: Phase F BORA_AUTHORIZED / SELECTED / NOT_YET_COMPLETED / READ_ONLY_DESIGN_ONLY, implementation_authorized=false, Phase G and every later roadmap phase PROPOSED_NOT_AUTHORIZED",
    "CHANGELOG.md records Bora's explicit 2026-09-13 Phase F authorization as a distinct human event, separate from Phase E acceptance",
    "the required focused tests fail closed on this new canonical authorization state",
    "the Phase D taxonomy/evaluator-coverage regression is updated only as needed to preserve Phase D under prior_prior_phase after Phase F authorization; this is a dependent stale-grader repair, not substantive Phase D or Phase F redesign",
    "no BLUEPRINT.md, CLAUDE.md, GEMINI.md, .cursor/**, .claude/**, src/**, schemas/**, claims/**, evidence/**, experiences/**, resume/**, golden-tests/**, fixtures/**, config/**, prompts/**, or docs/audits/** change exists in the diff",
    "no substantive CAREER_OS_RUN_TRACE_V1 schema, field design, typed-envelope design, trace contract, phase contract, storage architecture, database, UI, vendor selection, or runtime implementation is authored in this authorization sync",
    "no authorization or implication of authorization of Phase G or any later roadmap phase",
    "Phase E's accepted report substance, exact 15-case corpus, case-role taxonomy, executability taxonomy, evidence/provenance boundaries, terminal-vs-step distinction, and deterministic-first evaluator doctrine remain unchanged"
  ],
  "stop_conditions": [
    "change requires any path outside allowed_paths",
    "change would modify BLUEPRINT.md, CLAUDE.md, GEMINI.md, .cursor/**, .claude/**, src/**, schemas/**, claims/**, evidence/**, experiences/**, resume/**, golden-tests/**, fixtures/**, config/**, prompts/**, or docs/audits/**",
    "change would author, design, or implement substantive Phase F CAREER_OS_RUN_TRACE_V1 or typed-envelope/phase-contract architecture during this authorization sync",
    "change would introduce trace infrastructure, storage/database/UI, automation, a new runtime agent, model routing, provider abstraction, or an LLM judge",
    "change would authorize or imply authorization of Phase G or any later roadmap phase",
    "change would represent Phase F authorization as operator self-granted rather than Bora's explicit human event",
    "change would weaken or alter Phase E's BORA_ACCEPTED (2026-09-12) substantive architecture state"
  ],
  "review_requirements": "CURSOR_INDEPENDENT_ADVERSARIAL_REVIEW_REQUIRED_BEFORE_COMMIT; DETERMINISTIC_STATE_AND_FOCUSED_TESTS_REQUIRED; NO_COMMIT_PUSH_PR_OR_MERGE_AUTHORIZED_BY_THIS_CONTRACT_ALONE",
  "human_approval_requirements": "BORA_EXPLICITLY_AUTHORIZED_PHASE_F_TRACE_CONTRACT_ARCHITECTURE_AS_THE_NEXT_BOUNDED_READ_ONLY_DESIGN_ONLY_PHASE_ON_2026-09-13; NO_IMPLEMENTATION_AUTHORIZED; NO_SCOPE_EXPANSION"
}
