{
  "milestone_id": "CAREER_OS_BOUNDED_AGENT_BUILD_LOOP_V1",
  "kind": "IMPLEMENTATION",
  "goal": "Build the smallest deterministic, restart-safe local controller that executes one explicitly authorized Career OS engineering milestone through state verification, one bounded Claude Code builder loop, deterministic testing and repair, independent read-only Cursor review and bounded correction, full Assurance Baseline verification, and generation of a durable review package before stopping for Bora's explicit human approval. The controller must make repository/run-state continuity independent of ChatGPT, Claude, or Cursor conversation lifetime and must never redefine milestone authority.",
  "baseline_sha": "d854616286ae675dbd0b73e753ea4df306fe8d9e",
  "allowed_paths": [
    ".gitignore",
    "config/milestone_execution_policy_v1.json",
    "prompts/milestone_builder_v1.md",
    "prompts/milestone_reviewer_v1.md",
    "schemas/milestone_run.schema.json",
    "schemas/milestone_reviewer_result.schema.json",
    "src/milestone_run.py",
    "scripts/career_os_milestone.py",
    "tests/milestone_run_v1_test.py",
    "milestone_contracts/feature/career-os-bounded-agent-build-loop-v1.json",
    "docs/decisions/ADR-CAREER-OS-BOUNDED-AGENT-BUILD-LOOP-V1.md",
    "CURRENT_STATE.md",
    "CURRENT_MILESTONE.md",
    "CHANGELOG.md"
  ],
  "forbidden_paths": [
    "BLUEPRINT.md",
    "AGENTS.md",
    "CLAUDE.md",
    "GEMINI.md",
    "project_state.json",
    "schemas/project_state.schema.json",
    "schemas/milestone_contract.schema.json",
    "src/career_os_state.py",
    "scripts/verify_milestone_state.py",
    "scripts/verify_assurance_baseline.py",
    ".github/workflows/assurance-baseline.yml",
    "src/job_analysis.py",
    "src/job_decision.py",
    "src/requirement_source_role.py",
    "src/application_logic.py",
    "src/qualification_gate.py",
    "src/application_gate.py",
    "src/resume_validation.py",
    "schemas/job.schema.json",
    "schemas/job_analysis_result.schema.json",
    "schemas/resume_derivative.schema.json",
    "evidence/**",
    "claims/**",
    "resume/**",
    "golden-tests/**"
  ],
  "required_tests": [
    "tests/milestone_run_v1_test.py",
    "tests/career_os_state_v1_test.py"
  ],
  "acceptance_conditions": [
    "Controller preflight fetches/verifies origin/main and fails closed on incompatible baseline or repository state.",
    "A run receives a durable unique run_id and atomically persisted manifest/state transitions under a gitignored local run-state directory.",
    "A stopped/interrupted run can be resumed without relying on ChatGPT, Claude Code, or Cursor conversation history.",
    "Resume always re-verifies Git state, origin/main, contract integrity, branch/worktree identity, changed-path authority, and unauthorized mutation before continuing.",
    "Exactly one controller may own a governed branch/worktree at a time; stale-lock recovery is explicit and fail-closed.",
    "Retry budgets are finite and come from a separately versioned execution policy snapshotted into the run rather than redefining milestone semantic authorization.",
    "Claude Code is invoked only as the bounded builder and cannot mark the milestone successful, commit, push, merge, or modify contract/control files unless explicitly authorized.",
    "Deterministic tests decide mechanical test success and all successful test evidence is invalidated by later working-tree mutation.",
    "Cursor is invoked independently in a read-only review boundary using contract, baseline, actual diff, rules, and test evidence without Claude's persuasive implementation narrative.",
    "Required reviewer findings cannot be silently dismissed by an LLM; ambiguous or disputed findings surface HUMAN_REVIEW_REQUIRED.",
    "Full canonical Assurance Baseline must pass after the final reviewed diff before READY_FOR_HUMAN_APPROVAL.",
    "V1 stops at READY_FOR_HUMAN_APPROVAL and performs no commit, push, pull-request creation, merge, or autonomous Blueprint/doctrine modification.",
    "Runtime artifacts contain no credentials, secrets, chain-of-thought, or required dependence on raw model transcripts.",
    "python scripts/verify_milestone_state.py passes for the governed branch.",
    "python scripts/verify_assurance_baseline.py reports ALL PHASES PASSED.",
    "git diff --check is clean."
  ],
  "stop_conditions": [
    "origin/main or repository reality is incompatible with the authorized baseline or current run state",
    "contract snapshot/hash differs from the authorized governing contract",
    "implementation requires any path outside allowed_paths or any forbidden/protected surface",
    "implementation would require modifying BLUEPRINT.md, AGENTS.md, existing state/milestone judge machinery, Truth-layer schemas, qualification/decision runtime, or Golden Test expectations",
    "implementation requires changing canonical builder/reviewer roles or introducing Codex as a V1 dependency",
    "implementation requires commit, push, PR creation, merge, or other remote repository mutation",
    "implementation or review retry budget is exhausted",
    "reviewer finding is materially disputed or semantically ambiguous and cannot be resolved deterministically",
    "implementation requires a new third-party runtime dependency or credential architecture not already authorized",
    "a safe restart/resume state cannot be reconstructed from Git plus persisted run artifacts"
  ],
  "review_requirements": "CURSOR_INDEPENDENT_ADVERSARIAL_READ_ONLY_REVIEW_REQUIRED_BEFORE_READY_FOR_HUMAN_APPROVAL",
  "human_approval_requirements": "BORA_EXPLICIT_APPROVAL_REQUIRED_AFTER_REVIEW_AND_FULL_ASSURANCE; NO_COMMIT_PUSH_PR_OR_MERGE_IN_CONTROLLER_V1"
}
