{
  "milestone_id": "CAREER_OS_RECOMMENDATION_B_OPERATOR_COMPLETION_V1",
  "kind": "GOVERNANCE_SYNC",
  "baseline_sha": "0120bcde46a10f1ee7d5ec33e17f5fca7b8fc310",
  "goal": "Record CAREER_OS_MILESTONE_RUN_V1_TARGETED_OPTIMIZATION_V1 as COMPLETED_BY_OPERATOR / PENDING_BORA_ACCEPTANCE after independently verifying exact PR #63 canonical merge evidence. Preserve operator-completion vs human-acceptance separation, close Recommendation-B implementation authority, keep Recommendation C and Phase I+ unauthorized, and restore BLUEPRINT.md Section 133 OPERATE FIRST / BUILD SECOND as the post-acceptance default without authorizing a new engineering phase.",
  "allowed_paths": [
    "project_state.json",
    "CURRENT_EXECUTION_CHECKPOINT.json",
    "CURRENT_STATE.md",
    "CURRENT_MILESTONE.md",
    "AGENTS.md",
    "CHANGELOG.md",
    "docs/decisions/ADR-CAREER-OS-EVAL-HARNESS-SEQUENCE-V1.md",
    "milestone_contracts/governance/career-os-recommendation-b-completion-v1.json",
    "tests/career_os_recommendation_b_operator_completion_v1_test.py",
    "tests/career_os_phase_h_timing_acceptance_recommendation_b_authorization_v1_test.py",
    "tests/career_os_execution_checkpoint_v1_test.py",
    "tests/career_os_eval_harness_sequence_v1_test.py",
    "tests/career_os_agent_context_usage_efficiency_v1_test.py",
    "tests/career_os_phase_e_authorization_v1_test.py",
    "tests/career_os_phase_f_authorization_v1_test.py",
    "tests/career_os_phase_d_authorization_v1_test.py",
    "tests/career_os_phase_g_authorization_v1_test.py"
  ],
  "forbidden_paths": [
    "BLUEPRINT.md",
    "CLAUDE.md",
    "GEMINI.md",
    ".cursor/**",
    ".claude/**",
    ".github/**",
    "src/**",
    "scripts/**",
    "schemas/**",
    "claims/**",
    "evidence/**",
    "experiences/**",
    "resume/**",
    "golden-tests/**",
    "fixtures/**",
    "tests/milestone_run_v1_test.py",
    "milestone_contracts/feature/career-os-milestone-run-v1-targeted-optimization-v1.json"
  ],
  "required_tests": [
    "python tests/career_os_recommendation_b_operator_completion_v1_test.py",
    "python tests/career_os_phase_h_timing_acceptance_recommendation_b_authorization_v1_test.py",
    "python tests/career_os_execution_checkpoint_v1_test.py",
    "python tests/career_os_eval_harness_sequence_v1_test.py",
    "python tests/career_os_agent_context_usage_efficiency_v1_test.py",
    "python tests/career_os_phase_e_authorization_v1_test.py",
    "python tests/career_os_phase_f_authorization_v1_test.py",
    "python scripts/verify_milestone_state.py",
    "python scripts/verify_assurance_baseline.py",
    "git diff --check",
    "python tests/career_os_phase_d_authorization_v1_test.py",
    "python tests/career_os_phase_g_authorization_v1_test.py"
  ],
  "acceptance_conditions": [
    "PR #63 canonical merge, parent/ancestry, reviewed-tree equality, and hosted post-merge Assurance are recorded exactly.",
    "Recommendation B is COMPLETED_BY_OPERATOR but remains PENDING_BORA_ACCEPTANCE; no text claims Bora acceptance.",
    "Original Recommendation-B authorization history remains preserved distinctly from completion evidence.",
    "Recommendation C remains NOT_AUTHORIZED and Phase I+ remain PROPOSED_NOT_AUTHORIZED.",
    "No product/runtime/controller/Assurance/workflow or Recommendation-B implementation bytes change.",
    "BLUEPRINT.md Section 133 OPERATE FIRST / BUILD SECOND is referenced only as post-acceptance direction, not as authorization for a new engineering phase.",
    "Full canonical Assurance and milestone-state validation pass; independent Cursor review of frozen bytes returns SAFE before promotion.",
    "Every live ADR and AGENTS recovery section states Recommendation B is COMPLETED_BY_OPERATOR / PENDING_BORA_ACCEPTANCE; NOT_YET_COMPLETED appears only in clearly historical authorization context.",
    "project_state.next_authorized_action is complete, non-truncated, and ends with a coherent closed-authority statement.",
    "CHANGELOG.md retains the pre-existing continuity-note substance but places it and the completion entry beneath the canonical file header."
  ],
  "stop_conditions": [
    "any need to alter PR #63 implementation bytes",
    "any claim of Bora acceptance without an explicit human acceptance event",
    "any authorization of Recommendation C, Phase I, or another engineering milestone",
    "any weakening of deterministic validation or review requirements"
  ],
  "review_requirements": "MANDATORY_INDEPENDENT_CURSOR_ADVERSARIAL_REVIEW_OF_IMMUTABLE_BYTES_AFTER_FULL_ASSURANCE; Cursor reviewer-only; mutation after SAFE invalidates review.",
  "human_approval_requirements": "BORA_FINAL_ACCEPTANCE_REQUIRED_AFTER_OPERATOR_COMPLETION; operator completion never self-grants human acceptance."
}
